{
  "contract_version": "2.0-draft.1",
  "capability_id": "agt003.opportunity-copilot.preview",
  "correlation_id": "corr-synthetic-001",
  "snapshot_id": "snapshot-synthetic-001",
  "contact_channel": "whatsapp",
  "opportunity": {
    "opportunity_id": "opp-synthetic-001",
    "title": "Modernización de seguridad física",
    "company_name": "Empresa Sintética S.A.S.",
    "stage": "Contacto inicial",
    "service": "Seguridad electrónica",
    "owner_name": "Comercial Sintético",
    "facts": [
      {
        "evidence_id": "evidence:opportunity:stage",
        "field": "stage",
        "value": "Contacto inicial",
        "source": "SIIO"
      },
      {
        "evidence_id": "evidence:opportunity:service",
        "field": "service",
        "value": "Seguridad electrónica",
        "source": "SIIO"
      }
    ]
  },
  "interactions": [
    {
      "interaction_id": "interaction-synthetic-001",
      "interaction_type": "note",
      "occurred_at": "2030-02-01T10:00:00.000Z",
      "summary": "El cliente solicitó una conversación sobre cobertura de sedes.",
      "evidence_id": "evidence:interaction:001",
      "untrusted_crm_text": true
    }
  ],
  "approved_assets": [
    {
      "asset_id": "asset-synthetic-001",
      "title": "Brochure sintético de seguridad electrónica",
      "asset_type": "brochure",
      "url": "https://sharepoint.example.test/approved/asset-synthetic-001.pdf",
      "status": "approved",
      "valid_until": null,
      "tags": [
        "seguridad-electronica"
      ]
    }
  ],
  "authority": {
    "read_only": true,
    "human_review_required": true,
    "external_send_allowed": false,
    "crm_write_allowed": false,
    "public_research_allowed": false
  }
}
